<?xml version="1.0" encoding="UTF-8" standalone="no"?>
<!DOCTYPE LIMES SYSTEM "limes.dtd">
<LIMES>
	<PREFIX>
		<NAMESPACE>http://geovocab.org/geometry#</NAMESPACE>
		<LABEL>geom</LABEL>
	</PREFIX>
	<PREFIX>
		<NAMESPACE>http://www.opengis.net/ont/geosparql#</NAMESPACE>
		<LABEL>geos</LABEL>
	</PREFIX>
	<PREFIX>
		<NAMESPACE>http://linkedgeodata.org/ontology/</NAMESPACE>
		<LABEL>lgdo</LABEL>
	</PREFIX>
    <PREFIX>
        <NAMESPACE>http://www.w3.org/2000/01/rdf-schema#</NAMESPACE>
        <LABEL>rdfs</LABEL>
    </PREFIX>
	<SOURCE>
		<ID>linkedgeodata</ID>
		<ENDPOINT>http://linkedgeodata.org/sparql</ENDPOINT>
		<VAR>?x</VAR>
		<PAGESIZE>2000</PAGESIZE>
		<RESTRICTION>?x a lgdo:RelayBox</RESTRICTION>
		<PROPERTY>geom:geometry/geos:asWKT RENAME polygon</PROPERTY>
		<OPTIONAL_PROPERTY>rdfs:label</OPTIONAL_PROPERTY>
	</SOURCE>
	<TARGET>
		<ID>linkedgeodata</ID>
		<ENDPOINT>http://linkedgeodata.org/sparql</ENDPOINT>
		<VAR>?y</VAR>
		<PAGESIZE>2000</PAGESIZE>
		<RESTRICTION>?y a lgdo:RelayBox</RESTRICTION>
		<PROPERTY>geom:geometry/geos:asWKT RENAME polygon</PROPERTY>
                <OPTIONAL_PROPERTY>rdfs:label</OPTIONAL_PROPERTY>
	</TARGET>
	<METRIC>geo_hausdorff(x.polygon, y.polygon)</METRIC>
	<ACCEPTANCE>
		<THRESHOLD>0.9</THRESHOLD>
		<FILE>lgd_relaybox_verynear.nt</FILE>
		<RELATION>lgdo:near</RELATION>
	</ACCEPTANCE>
	<REVIEW>
		<THRESHOLD>0.5</THRESHOLD>
		<FILE>lgd_relaybox_near.nt</FILE>
		<RELATION>lgdo:near</RELATION>
	</REVIEW>

	<EXECUTION>
		<REWRITER>default</REWRITER>
		<PLANNER>default</PLANNER>
		<ENGINE>default</ENGINE>
	</EXECUTION>

	<OUTPUT>TAB</OUTPUT>
</LIMES>
