<?xml version="1.0" encoding="UTF-8"?>
<!--Sample XML file generated by XMLSpy v2010 rel. 3 sp1 (http://www.altova.com)-->
<!DOCTYPE LIMES SYSTEM "limes.dtd">
<LIMES>
	<SOURCE>
		<ID>dblp2</ID>
		<ENDPOINT>src/main/resources/datasets/DBLP-ACM/DBLP2.csv</ENDPOINT>
		<VAR>?x</VAR>
		<PAGESIZE>-1</PAGESIZE>
		<RESTRICTION></RESTRICTION>
		<PROPERTY>title AS lowercase</PROPERTY>
		<PROPERTY>authors AS lowercase</PROPERTY>
		<PROPERTY>venue AS lowercase</PROPERTY>
		<!--<PROPERTY>year AS number</PROPERTY> --> 
		<TYPE>CSV</TYPE>
	</SOURCE>
	<TARGET>
		<ID>acm</ID>
		<ENDPOINT>src/main/resources/datasets/DBLP-ACM/ACM.csv</ENDPOINT>
		<VAR>?y</VAR>
		<PAGESIZE>-1</PAGESIZE>
		<RESTRICTION></RESTRICTION>
		<PROPERTY>title AS lowercase</PROPERTY>
		<PROPERTY>authors AS lowercase</PROPERTY>
		<PROPERTY>venue AS lowercase</PROPERTY>
		<!--<PROPERTY>year AS number</PROPERTY>-->
		<TYPE>CSV</TYPE>
	</TARGET>
	
	<METRIC>AND(trigrams(x.title,y.title)|0.11,euclidean(x.year,y.year)|0.83)</METRIC>
	<ACCEPTANCE>
		<THRESHOLD>0.62</THRESHOLD>
		<FILE>pub_accepted.txt</FILE>
		<RELATION>owl:sameAs</RELATION>
	</ACCEPTANCE>
	<REVIEW>
		<THRESHOLD>0.5</THRESHOLD>
		<FILE>pub_reviewme.txt</FILE>
		<RELATION>owl:sameAs</RELATION>
	</REVIEW>
	<EXECUTION>
		<REWRITER>default</REWRITER>
		<PLANNER>default</PLANNER>
		<ENGINE>default</ENGINE>
	</EXECUTION>
	<OUTPUT>N3</OUTPUT>
</LIMES>
